{
  "$schema": "https://tet.local/schemas/section.schema.json",
  "schemaVersion": 1,
  "databaseId": "utet-paper-2-language-1-ur",
  "exam": "utet",
  "paper": 2,
  "section": "language",
  "language": "ur",
  "languageSlot": 1,
  "contentMode": "language-specific",
  "questionsFile": "questions.ndjson",
  "stimuliFile": "stimuli.ndjson",
  "status": "empty"
}
