{
  "$schema": "https://tet.local/schemas/section.schema.json",
  "schemaVersion": 1,
  "databaseId": "ctet-paper-1-language-1-en",
  "exam": "ctet",
  "paper": 1,
  "section": "language",
  "language": "en",
  "languageSlot": 1,
  "contentMode": "language-specific",
  "questionsFile": "questions.ndjson",
  "stimuliFile": "stimuli.ndjson",
  "status": "empty"
}
